{
  "schema_version": "0.1.0",
  "repository": "https://github.com/xai-org/grok-build",
  "observed_at": "2026-07-23",
  "build_repo_commit": "a5727c5960452e7527a154b25cb5bf00cda0545e",
  "source_rev": "30192d2eef5d91a8fff0e53957de5bd05b43398c",
  "readme_sha256": "322066de9f5bc136295bd0ae4f1752cef3d8dcb1a8f9d88044609e7b6d7abcf7",
  "integration_mode": "prebuilt-headless-sidecar",
  "distribution": {
    "windows_prebuilt": "published",
    "windows_source_build": "best-effort-not-supported-host"
  },
  "binary_release": {
    "status": "verified-local",
    "channel": "stable",
    "version": "0.2.111",
    "build_id": "94172f2aa4",
    "artifact_url": "https://x.ai/cli/grok-0.2.111-windows-x86_64.exe",
    "bytes": 137980232,
    "md5": "ab3b37ddc85e8fa9c7bdb2633bdfcf19",
    "sha256": "a3614df24080471709d096a2e47ce7f6c84443af1cb59b7363967858858bc9bc",
    "authenticode_status": "Valid",
    "signer_common_name": "X.AI LLC",
    "installed_path": ".tools/grok/0.2.111/grok.exe",
    "source_correspondence": "unverified"
  },
  "ownership": {
    "upstream_runtime": [
      "acp",
      "headless_cli",
      "model_http_transport",
      "permissions",
      "sandbox",
      "session_persistence",
      "tool_runtime",
      "tui",
      "workspace"
    ],
    "lif_integration": [
      "claim_boundary",
      "evidence_kernel",
      "evaluation_runner",
      "leak_scanner",
      "scenario_exporter",
      "source_router",
      "task_contract",
      "validator_bridge",
      "windows_launch_and_credential_bridge"
    ],
    "conformance_fixtures": [
      "deepseek_reasoning_continuity",
      "deepseek_request_shape",
      "journal_redaction",
      "windows_process_cancellation"
    ]
  }
}
